creationTime,userClientShow,userLevelName,productSize,productColor,saleValue,content
2018-04-22 19:53:40,来自京东Android客户端,PLUS会员,标准版,亮黑色,6GB+128GB,我对京东的服务一直特别满意，我也很想支持国货，支持华为手机，为什么买到手确是一个伤心，请评论的朋友能不能说点良心话，你们是不是华为的拖啊？这手机屏幕分辨率低，打开功能反应迟钝，无语！无语！无语！
2018-04-22 18:36:54,来自京东Android客户端,银牌会员,标准版,宝石蓝,6GB+64GB,缺件，什么高级厂家哦?3.5mm的耳机转接头被工人吃了，盒子也变形了，我是真的服了。我直接就是一个差评，开始客服电话繁忙，打了半天。终于有人处理了唉?3788果然没毛病
2018-04-22 12:07:46,来自京东Android客户端,金牌会员,标准版,亮黑色,6GB+64GB,第一次差评，说实话这手机值不起这个价，性能不强，还发烫，续航也不强，真是令人失望
2018-04-21 22:22:31,来自京东Android客户端,金牌会员,标准版,亮黑色,6GB+64GB,屏幕阴阳屏，后面摄像头有一粒灰尘，还好都不影响使用
2018-04-21 20:48:23,来自京东iPhone客户端,钻石会员,标准版,亮黑色,6GB+64GB,以前给父亲买的华为挺好的，这次买一个好点的P20，系统简直#，接听电话有防触控模式也没有关闭按钮，s..B设计工程师
2018-04-21 20:20:09,来自京东Android客户端,金牌会员,标准版,亮黑色,6GB+64GB,钢化膜都不送一个
2018-04-21 17:36:09,来自京东Android客户端,银牌会员,标准版,樱粉金,6GB+128GB,挺好看的 但是打游戏还是会卡 特意用了两天才来评论的 玩荒野 刺激战场都有点卡 电量还行 一般 不能说续航时间很长 手机还是很厚的  拍照额 能接受 总体一般
2018-04-21 17:01:05,,PLUS会员,标准版,亮黑色,6GB+128GB,稀烂
2018-04-21 12:41:09,,钻石会员,标准版,亮黑色,6GB+64GB,整体就是感觉容易发烫
2018-04-21 08:23:41,来自京东iPhone客户端,银牌会员,标准版,亮黑色,6GB+64GB,请大家不要上当受骗，电池不耐用，打游戏非常卡，就是说看网络电视也是非常卡。退货也非常慢，还和苹果比，华为真是脑子有毛病
2018-04-20 19:59:39,来自京东Android客户端,银牌会员,标准版,亮黑色,6GB+64GB,讲真的，性价比不是很高。感觉浪费钱。
2018-04-20 18:05:52,来自京东Android客户端,银牌会员,标准版,亮黑色,6GB+128GB,刚买到手的，竟然卡
2018-04-20 16:45:14,,银牌会员,标准版,亮黑色,6GB+128GB,这家店是黑店  各位不要上当了  退货要扣钱的  售后也没有人解决问题
2018-04-20 13:18:35,来自京东Android客户端,金牌会员,标准版,亮黑色,6GB+64GB,运行内存也就2-3g 拍照啥的还好吧
2018-04-20 08:12:41,来自京东Android客户端,钻石会员,标准版,宝石蓝,6GB+128GB,电池不行不耐用，新手机一天都检查坚持不下去。不玩游戏的话还是可以的
2018-04-19 20:42:04,来自京东Android客户端,金牌会员,标准版,宝石蓝,6GB+64GB,很不开心 感觉啥也没送 用起来感觉也一般般 今天荣耀10出来了 贵一千二 不知道贵在哪儿&hellip;&hellip; 买了也没啥办法退 希望多用几年吧
2018-04-19 16:30:55,来自京东Android客户端,金牌会员,标准版,宝石蓝,6GB+64GB,其他都挺好的，就是声音加减键有问题，每次加减声音都弹不上来，容易卡住
2018-04-19 16:14:28,来自京东Android客户端,银牌会员,标准版,宝石蓝,6GB+64GB,首先呢，后置摄像头设计不好，竟然可以看到里面的电子元件，而且，玩儿游戏也卡，画质不够清楚，外放声音真的无力吐槽，机型外观还好，就是不值这个价格
2018-04-19 14:54:41,来自京东Android客户端,PLUS会员,标准版,宝石蓝,6GB+128GB,卖了mate10买的这货，拍照mate10强百倍，续航相差不多，屏幕mate10强百倍，听课华为吹的牛逼才买的，买后发现自拍垃圾，前置一般跟三星s7都没得比，屏幕一般，自己看屏幕塑料的边框感觉像是让人用了很多年一样，都怀疑是不是新机了，以后再也不买华为了，真的是华而不实为所欲为。
2018-04-19 13:13:33,来自京东Android客户端,PLUS会员,标准版,宝石蓝,6GB+128GB,4月13 日买的，部分时间段没货，也是关注了挺长时间才下的手，本来想买mate10 pro，还是觉得新品有新技术还是选新品吧，人脸识别挺快的，锁屏时拿起手机就解锁了，手机选6+128的，运行很快，一般都有3g左右的剩余内存，电量一般，一天也够用了。总体挺不错的，其实还是觉得p20 pro好，当天就是抢不到。当时担心6寸太大 其实是顾虑太大了。
2018-04-19 13:11:31,来自微信购物,银牌会员,标准版,宝石蓝,6GB+128GB,买了好几天了  今天用了下导航  手机严重发热  手都不敢摸了 比小米发热还厉害  不建议购买
2018-04-18 22:42:50,来自京东Android客户端,金牌会员,标准版,亮黑色,6GB+128GB,玩吃鸡卡得要死，不知道是什么问题，反正不是我自身问题，不要跟我说要清什么清什么的，都假的很。希望能来点实在的，把打游戏卡顿的情况处理一下?
2018-04-18 21:55:31,,钻石会员,标准版,亮黑色,6GB+64GB,阿斯分阶段考虑撒酒疯看了电视剧看了
2018-04-18 16:17:10,来自京东Android客户端,金牌会员,标准版,亮黑色,6GB+64GB,手机算可以     一星是给京东客服的    包装简陋      本来该一天就到    客服都把责任乱推     有说一天到的     有说一天半到的       还有说一到三天到的
2018-04-18 12:14:43,来自微信购物,金牌会员,标准版,亮黑色,6GB+128GB,一星是给京东快递小哥的，服务及时热情。华为手机不是第一次买了，但这次很失望。才买了3天，一直带软套使用的，无意间拿下套子发现中框上居然掉漆了，退换是不可能了，只能自认倒霉;说一下使用感受，1手机和蓝牙手环无法连接（用荣耀7的时候能秒连，每个电话信息都有提醒到。）2手机看视频模糊，打游戏发热厉害。
2018-04-17 23:32:46,来自京东Android客户端,PLUS会员,标准版,宝石蓝,6GB+64GB,还行吧，外放音质差，正面摄像头占屏幕，另外部分应用说不支持截屏
2018-04-17 22:51:09,,金牌会员,标准版,亮黑色,6GB+64GB,电池不耐用，卡顿；品控太差劲，屏幕低端发黄，与宣传极其不符；垃圾，还比不上以前的旧手机。
2018-04-17 18:02:02,来自京东Android客户端,金牌会员,标准版,宝石蓝,6GB+128GB,不怎么样，感觉贵了
2018-04-17 15:52:58,来自京东Android客户端,银牌会员,标准版,香槟金,6GB+64GB,电池早上七点出门是百分之90多，然后到中午十一点电量不足二十。我也是醉了。然后客服服务真的很差。发消息都不会回我。   要不是小米买不到，真的就没有考虑华为   ，第一次买很让我失望。
2018-04-17 14:13:17,来自京东Android客户端,金牌会员,标准版,亮黑色,6GB+128GB,其他都好，就是摄像头不正，都能看到里面的电子元件
2018-04-17 13:39:21,来自京东Android客户端,金牌会员,标准版,宝石蓝,6GB+64GB,**手机，电池电量只能用到2%，充电也是从2%开始充的，售后技术部的爱理不理，说这是正常情况为了保护电池的，如果这是正常现象还要设计100%的电池干嘛？还无缘无故的重新启动了2次，新买的手机会这个样子？*的华为水军，为所欲为，华而不实，想说爱国真的不容易，！
2018-04-17 10:23:51,来自京东Android客户端,银牌会员,标准版,樱粉金,6GB+64GB,"好评给京东，差评给华为。1.差评原因：①号称华为旗舰机的p系列，品控太差劲，屏幕低端发黄，屏幕上部发白，典型的阴阳屏。跟朋友一起买的，他的也有这个问题，目测这个问题概率非常大，而且朋友的眼睛看不出来，所以应该是对色彩比较敏感的人才可以看出来，估计很难评定这个问题，所以懒得换了。②拍照时候，远远地拍草地和树木时候，涂抹感极其严重，颜色太鲜艳导致失真，总体显得非常假，拍照宣传的太厉害了，名不副实。
2.优点：说完缺点说优点①机身纤瘦，一体感很好，宛如艺术品，非常漂亮，女生拿着大小很合适，后壳很漂亮。②拍照自拍很美，后置拍人也很美，美颜自然清晰，在比较近的位置拍花、物之类的表现出色，拍照还是有一点优势的。③电池很够用，晚上待机一晚上没有耗费一点电。④操作灵敏，作为不玩儿游戏的人，零卡顿。据朋友说吃鸡只能标清。
总体能打60分，但是对于宣传这么厉害，号称国产良心的华为，妥妥差评。"
2018-04-17 10:00:57,,银牌会员,标准版,亮黑色,6GB+64GB,全面屏？第一感觉长宽不美观，太长太窄，屏幕太小，整体屏幕还没有人家不是全面屏的大呢?现在起码得是5.99的屏吧？还有太裸。。。用pro的宣传，低配的就弄得这么垃圾啊，别人用过p10的都说，p10和p20有区别吗？回答是没什么太大区别，倒是和pro区别挺大。。。。。。。。。。。。。。
2018-04-16 20:56:54,来自京东Android客户端,钻石会员,标准版,宝石蓝,6GB+64GB,#，手机克隆总是连不上，设置阶段没有办法查看短信，这么NC经过测试了吗？
2018-04-16 20:53:10,来自京东Android客户端,PLUS会员,标准版,亮黑色,6GB+128GB,预售的时候显示购机送半年碎屏险，结果没在店里买，选了京东预约。结果现在打客服说，当时没有送碎屏险。无语呀，哪个小伙伴有截图，抵制不要脸的京东。客服还说只显示了优惠，我说哪有优惠呀，她说从9999优惠到4288，你牛。。。
2018-04-16 19:53:34,来自京东Android客户端,金牌会员,标准版,宝石蓝,6GB+64GB,耳机插进去没有声音，一直在外放，失望?
2018-04-16 12:38:27,来自京东Android客户端,PLUS会员,标准版,宝石蓝,6GB+64GB,其他还好，我的显示字体有微弱的锯齿状，网格状态特别明显。
2018-04-16 07:08:19,来自京东Android客户端,PLUS会员,标准版,宝石蓝,6GB+64GB,"盼了好久终于等到12号，第一时间就抢了一部，华为这次让我有点失望。其他的不必多说，和宣传的一样。有一个缺点，通话质量很差，我得是移动信号，打电话有时候对方听不见，有时候断断续续的，但是同是在办公室，别人的手机信号就很好，这种情况出现了好几次了。我前一部手机用的是荣耀，没出现过这个问题。
还有，不是增电话卡麽，是不是收到货后就不能申请了？
联系客服也不会答。
总之，失望！！！！"
2018-04-15 23:03:46,来自京东Android客户端,PLUS会员,标准版,宝石蓝,6GB+64GB,指纹收集器，还有新耳机漏电 超级快充改超级外漏？！
2018-04-15 19:14:00,来自京东Android客户端,PLUS会员,标准版,宝石蓝,6GB+64GB,差评，预约也没有赠送碎屏险！！！！
2018-04-15 18:33:48,来自京东Android客户端,金牌会员,标准版,樱粉金,6GB+128GB,差评！提前10天付*元定金买的啥都不送，发布后当下买的送碎屏险，真#！
2018-04-15 15:08:12,来自京东Android客户端,银牌会员,标准版,香槟金,6GB+64GB,不知道是不是软件不兼容的问题，大家可以试下刷抖音的时候屏幕被放大，有的字被遮住了，看着特别难受，两个手机同一个视频对比了一下确实是P20有问题。客服和技术部反馈说是抖音软件的问题，不适用华为新系统新屏幕，但是刚出的新品就这样不负责，还一直推脱说是别人的问题，让我去跟他们投诉，作为商家，不想着怎么给客户解决问题，只推脱责任，不重视，那这个新品全是毁了，得到的只是用户的不信任跟抛弃。其他功能还好，目前只发现这个问题，还在踢皮球，没有人解决，京东的物流特别给力。
2018-04-15 14:28:08,来自微信购物,银牌会员,标准版,樱粉金,6GB+64GB,什么都没有送，还没有我们当地手机店出来的早，送的东西也多，也就这一次了，连个手机膜都没有！！！！！
2018-04-15 14:19:05,来自京东Android客户端,金牌会员,标准版,亮黑色,6GB+64GB,电池不耐用，运行速度也没明显优势（之前用vivox9plus），现在深深体会到什么叫水军的力量。说拍照如何如何了得，呸(*｀へ&acute;*)我感觉没有我的旧手机好，更别论水果机了。第一天用拍照功能居然还死机了。差评！拍照效果也不行。真是全告吹的。没有荣耀9性价比高！
2018-04-15 11:45:09,来自京东Android客户端,银牌会员,标准版,亮黑色,6GB+128GB,包装就一个纸壳子，都没点防护，连个贴膜都没有
2018-04-15 10:49:14,来自京东Android客户端,PLUS会员,标准版,宝石蓝,6GB+64GB,和前面差评一样，摄像头是歪的，注册会员还是普卡，居然不是金卡，不知道是不是别人退货的，被别人注册了，客服也联系不上。还不如我以前买的荣耀
2018-04-15 09:47:24,来自京东Android客户端,金牌会员,标准版,宝石蓝,6GB+64GB,手机非常好，但是我一台应该有点问题，音响孔只有一个有声音，而且相机那里有一道裂缝，咨询了客服没有回复，我希望可以换货
2018-04-14 18:27:44,来自京东Android客户端,钻石会员,标准版,宝石蓝,6GB+64GB,说好999预订碎屏险呢？不不止我一个人看到吧？ 说没有就没有？ 差评不解释
2018-04-14 10:45:29,来自京东iPhone客户端,PLUS会员,标准版,宝石蓝,6GB+64GB,华为质检太垃圾了，后壳玻璃开箱就是带裂痕的，还有几道明显划痕，还卖这么贵
2018-04-14 09:35:10,来自京东Android客户端,金牌会员,标准版,香槟金,6GB+64GB,好多应用不能卸载，相机没荣耀7的好，只是支持国产
2018-04-14 08:10:42,来自京东iPhone客户端,金牌会员,标准版,亮黑色,6GB+64GB,第一预付的999凭什么我不付尾款你就不退。第二昨天的差评哪去了 开始没发现也是看品论才知道 摄像头下面那个不同心 我估计是加工偏差 很明显 别和我说？戴手机套是偏的 我就干制造业做手机前期设备的 屏幕下部分发黄不知道啥原因。 显示效果真一般。哎 希望国货当志强。 别天天和你们余大爷样。什么水平还天天发布新产品 不是黑 我家苹果换掉的全是华为。哀其不幸怒其不争
2018-04-14 00:09:40,来自京东iPhone客户端,金牌会员,标准版,宝石蓝,6GB+64GB,摄像头太歪了，偏一点也就算了，偏这么多这做工也太糙了点，当初p9就是阴阳屏换了两次，麻烦死了，这次实在不想换了，哎
2018-04-13 21:36:56,来自京东Android客户端,PLUS会员,标准版,宝石蓝,6GB+64GB,除了拍照外，一无是处
2018-04-13 20:28:31,来自京东iPhone客户端,金牌会员,标准版,宝石蓝,6GB+64GB,"其他还好两个缺点不好
屏幕阴阳屏严重！特别严重！上面白下面黄！
语音助手不够人性化！"
2018-04-13 19:15:27,来自京东Android客户端,钻石会员,标准版,宝石蓝,6GB+64GB,这就是你们说的，一天充一次。我今天都冲两次了，本来一星都不想给，看在下这么大的雨，快递小哥还准时送到，勉强给一星
2018-04-13 16:55:09,来自京东Android客户端,钻石会员,标准版,宝石蓝,6GB+64GB,耳机插进去没有用，还是一直外放音乐，有点失望哦，请问下啷个解决呢?
2018-04-13 14:18:03,来自京东Android客户端,PLUS会员,标准版,亮黑色,6GB+64GB,性价比一般般，跑分就这个水准。比某米贵*，分比人家低7万。系统也没人家优化的好。无奈买不到某米，只能退而求其次了。
2018-04-13 11:07:26,来自京东Android客户端,PLUS会员,标准版,樱粉金,6GB+64GB,手机挺好看的?
