creationTime,userClientShow,userLevelName,productSize,productColor,saleValue,content
2018-04-27 13:32:43,来自京东iPhone客户端,钻石会员,标准版,亮黑色,6GB+64GB,我不知道是不是其他人也一样，手机音量键和开关键非常松动，摇手机的时候还能听到按键晃动的声音，提出售后要求换机，京东来电话说手机没问题，但会给我换机。今天收到货，明显还是我退回的那台，按键还是松动的，手机背面膜还是脏的，屏幕上的膜还是黏的，你京东如果说华为新机就是这样的，那我无话可说。
2018-04-26 10:49:21,来自京东Android客户端,金牌会员,标准版,宝石蓝,6GB+128GB,耗电很快，真心还没我p9待机长
2018-04-15 09:47:24,来自京东Android客户端,金牌会员,标准版,宝石蓝,6GB+64GB,手机非常好，但是我一台应该有点问题，音响孔只有一个有声音，而且相机那里有一道裂缝，咨询了客服没有回复，我希望可以换货
2018-04-19 13:11:31,来自微信购物,银牌会员,标准版,宝石蓝,6GB+128GB,买了好几天了  今天用了下导航  手机严重发热  手都不敢摸了 比小米发热还厉害  不建议购买
2018-05-07 18:13:25,来自京东Android客户端,金牌会员,标准版,亮黑色,6GB+64GB,我本来就想试一下这款手机跟小米mix2s，看到是无理由退货才下单买的。才到一天放在口袋都不敢跟金属类物品接触，第二天去退货就发现通话口有这样的划痕就无法退了，我真是醉了，我是真没咋用，唉，劝各位还是把钱花在小米mix2s上吧。
2018-05-14 22:11:09,来自京东Android客户端,钻石会员,标准版,亮黑色,6GB+128GB,我是看到华为推广云电脑的宣传，可以用云电脑，才买的p20，现在买到手了，发现云电脑需要申请邀请码才能用，昨天申请了，到现在也没收到邀请码，我可以直接购买使用云电脑，为什么不开放购买？如果不能使用云电脑，我会考虑退货，请售后看到转告，此举涉嫌欺诈宣传
2018-05-10 12:26:58,来自京东Android客户端,PLUS会员,标准版,亮黑色,6GB+64GB,对于P20来讲，3788这个价位真的非常不值，本来想买个宣传成大神级的低配，可是这和4000像素，三摄像头徕卡完全不搭边，宣传的是pro啊，那么这款不带pro的是什么鬼？就是个2999元价位的国产机，。真的很失望
2018-04-23 20:50:49,来自京东Android客户端,银牌会员,标准版,宝石蓝,6GB+128GB,一颗星都不想给，我总觉得我的手机铃声低，要不是同事帮我测试我都发现不了左边的喇叭竟然没有声音，大家高兴之于还是检查一下自己的手机吧
2018-05-15 23:02:05,,银牌会员,标准版,亮黑色,6GB+64GB,使用几天后陆续出现过几次屏幕卡死，屏幕不受控制问题，强制重启几次后正常，当时也没在意，一个月后这种情况再次发生了，屏幕完全不受控制，会自动启动APP，自己闪跳，无论怎么重启关机都没用，真是无语了这手机，太垃圾了，体验感糟糕透顶。
2018-04-26 11:15:53,,金牌会员,标准版,香槟金,6GB+128GB,京东服务让人无语，因为颜色取消了订单，然后要求配送，客服反复内部确认告诉我无法送货，让我重新下单，然后又送货了，折腾了十多个电话，拜托能不能专业一点。
2018-04-25 22:02:33,来自京东Android客户端,金牌会员,标准版,宝石蓝,6GB+64GB,对于当下很便捷的支付，华为的手机居然不支持微信指纹支付。真的很难理解，国产机器居然这么狗，外来机居然都可以了。垃。。圾然不让打，京东也是#。
2018-05-20 18:38:26,来自京东Android客户端,金牌会员,标准版,亮黑色,6GB+64GB,说实话一分都不想给，第一次用华为也是最后一部华为，差到爆，看抖音，糗事百科都卡，卡到怀疑人生，打王者就更不用说了，分分钟460真的徒有虚名，虎门镇中心，不存在信号差，同等无线网下，米5就可以秒杀它！伤心
2018-05-20 23:27:01,来自京东Android客户端,金牌会员,标准版,樱粉金,6GB+64GB,不得不说，这是我用过最烂的一款手机，待机只有一天一夜，玩手游居然会卡退，看网页广告无法过滤，操作也很不舒服，虽然不卡，但经常会出现操作上的bug。我用华为三年了，从p8开始，mate9.荣耀9每一个给我的感觉都非常好，但这款，太让人失望了
2018-05-10 23:31:53,来自京东Android客户端,PLUS会员,标准版,宝石蓝,6GB+128GB,只能说外观还行吧，手机确实有点坑 ，好多应用都只能强制用华为自己帐号，之前用其他品牌的手机玩游戏的建议就不要买了，因为买了只要开机就不能退换了，电池也就那样待机时间短也就那样
2018-04-21 20:48:23,来自京东iPhone客户端,钻石会员,标准版,亮黑色,6GB+64GB,以前给父亲买的华为挺好的，这次买一个好点的P20，系统简直#，接听电话有防触控模式也没有关闭按钮，s..B设计工程师
2018-05-23 16:33:33,来自京东Android客户端,PLUS会员,标准版,亮黑色,6GB+128GB,第一次买华为，不知道会自带手机膜和壳。我多花50买的壳膜套餐，收到的壳和膜还没自带的好，最可恨的是，收到后过了几天就搞活动降价了，可买套餐不能保价！里外里亏了200多，气死我了！
2018-05-08 18:19:32,来自京东Android客户端,银牌会员,标准版,亮黑色,6GB+64GB,前天买的刚刚1点充电的时候放歌放个一首不放了 放的时候还卡了两下 太困也没看 刚刚起床还是那么多电还死机了屏幕一直亮着手机非常烫 怪好没有炸 是不是该给客户交代呢？？？？
2018-04-30 21:35:04,来自京东Android客户端,PLUS会员,标准版,亮黑色,6GB+64GB,刚收到，手机不错，但京东工作人员的工作态度有问题，我的手机膜居然刮花了，还有压痕，只好自己去重贴一张膜，这是在京东购物最不爽的一次。我可以怀疑手机是别人退货的问题机吗？
2018-05-24 20:54:43,来自京东Android客户端,银牌会员,标准版,宝石蓝,6GB+64GB,我感觉这不是原装的，两摄像头偏上，像是维修过的机子！希望给个满意的答复！
2018-05-19 21:16:20,来自京东iPhone客户端,钻石会员,标准版,樱粉金,6GB+64GB,这个手机外观真的很好，但是机器性能真的好差，吃鸡卡的一比，拿个@啪啪啪，转头换@，等了三秒发现对方挂了，远战都卡，不说近战了。iphone6s比这个便宜几百块，吃鸡却流畅很多。擦亮眼睛
2018-05-10 00:53:52,来自京东Android客户端,金牌会员,标准版,亮黑色,6GB+64GB,手机是好手机，但是这个包装要吐槽一下，为什么手机在盒子里面没有固定，我昨天晚上下的单，今天就到了，很激动，结果手机盒一打开手机就掉地上，手机边缘都给磕花了，心情一下就不开心了
2018-05-25 19:21:47,来自京东iPhone客户端,钻石会员,标准版,宝石蓝,6GB+64GB,"非常糟糕的体验，经过mate10和p20之后,彻底粉转黑，这台机子碰到通话杂音，发热巨大的问题，从此是路人，手上的华为坏了再也不会买了，连我的华为电信定制机都比不上。申请退货退款了。无爱。"
2018-05-02 13:47:54,来自京东Android客户端,金牌会员,标准版,亮黑色,6GB+64GB,一星都不想给，但只能给一个，前天买到，登录微信，玩个小程序游戏，微信自动重启一整天都这样，返回界面卡顿延迟？截图失效，买了好几部华为，从都没这样过，非常非常失望，
2018-05-19 14:01:12,来自京东iPhone客户端,银牌会员,标准版,宝石蓝,6GB+64GB,包装是小米的 收件人另有其人 到底包装盒内小米还是我的华为
2018-05-21 13:48:57,来自京东iPhone客户端,金牌会员,标准版,宝石蓝,6GB+64GB,手机用了几天就出现闪屏，去特约授权点检测是液晶屏故障，果断换货，如果不是超出7天的话要退款的，很失望啊，华为的硬件故障还是蛮多的，坐在维修网点的半个小时就来了三个用户检测手机故障！
2018-04-15 23:03:46,来自京东Android客户端,PLUS会员,标准版,宝石蓝,6GB+64GB,指纹收集器，还有新耳机漏电 超级快充改超级外漏？！
2018-05-28 12:18:42,来自京东Android客户端,金牌会员,标准版,亮黑色,6GB+64GB,后悔花这么多钱买个华为，真的不如小米，这才多久啊就卡的要死，发烫也严重，打着爱国的旗号就这种质量啊，以后再不买华为。后悔死了，希望要买的好好斟酌。这是我的使用心得。
2018-04-29 21:35:51,来自京东Android客户端,银牌会员,标准版,樱粉金,6GB+64GB,京东服务很好的啦，物流超快的啦，手机这个锅京东是背定的啦，充电一分钟，暖手半小时的啦，冬天出门取暖神器的啦，地图软件开启两秒钟，GPS定位&hellip;&hellip;等一下？定位？不存在的，地图说它无法定位，再开也说无法定位，最后再开一次说定位？这辈子都不可能定位的啦。最后一百度就全明白了啦
2018-04-24 00:37:05,来自京东Android客户端,PLUS会员,标准版,亮黑色,6GB+64GB,打电话对面的听不到我说话，申请换货了，希望换了之后不会让我失望吧。
2018-05-23 18:27:41,来自微信购物,银牌会员,标准版,亮黑色,6GB+64GB,手机音质太差，经常是忙音，而且再接听电话的时候声音断断续续的，真怀疑是不是坏手机修了之后寄出来的，看到那么多好评我才买的，结果却是这样，黑店，
2018-05-25 17:53:10,来自京东Android客户端,金牌会员,标准版,亮黑色,6GB+64GB,**京东   返厂货
2018-05-07 12:27:30,来自京东Android客户端,PLUS会员,标准版,亮黑色,6GB+64GB,手机的电量消耗太快了
2018-05-14 17:17:04,来自京东Android客户端,银牌会员,标准版,亮黑色,6GB+64GB,打游戏的话就不要选择这个手机了，讲真游戏体验极差，打王者荣耀超级不舒服，吃鸡的话一会手机就烫个跟个暖宝宝一样。嗯，就打游戏特别差劲。
2018-05-26 09:51:03,来自京东iPhone客户端,金牌会员,标准版,极光色,6GB+128GB,前置摄像头，强制美颜！美颜等级设置为零时也磨皮发白的厉害，简直无法直视！作为相机无法拍出真实的人像，此设计太失败，太失败！
2018-05-05 15:56:36,来自京东Android客户端,银牌会员,标准版,亮黑色,6GB+64GB,这么说吧！不值  我说真的后台应用打开三个就杀死一个  玩吃鸡还闪退  要不是等不上抢不上某米谁买这玩意儿  真的是糟蹋钱
2018-05-21 13:25:57,来自京东Android客户端,PLUS会员,标准版,宝石蓝,6GB+64GB,没买的时候感觉选择p20应该错不了，到手了以后很后悔还不如多加几百块钱买个三星s8  这电话用着太恶心了，
2018-05-05 09:30:03,来自京东Android客户端,金牌会员,标准版,亮黑色,6GB+64GB,4号问客服5号华为p20有活动有优惠么？客服说没有，结果东西还没收到就说送半年的碎屏保险。我又不是不买你至于骗我么？
2018-05-21 16:05:19,来自京东Android客户端,钻石会员,标准版,香槟金,6GB+128GB,这款手机不值得购买，最起码不适合男性使用，什么手感啊，也不好看，不如以前用的麦芒和畅玩。。。。购买需谨慎，毕竟也不少钱呢。
2018-05-22 15:58:23,来自京东iPhone客户端,金牌会员,标准版,极光色,6GB+128GB,很大嫌疑翻新机，21号下单有十号下载记录。找客服居然告诉我随机抽取拨测，马上打电话给华为，华为客服告诉我出厂没有什么拨测。
2018-05-24 00:48:19,来自京东Android客户端,PLUS会员,标准版,亮黑色,6GB+128GB,"一般   机子没用多长时间就开始卡了    唉     太一般了   
真不敢想以后会不会越来越卡"
2018-05-20 22:02:59,来自微信购物,金牌会员,标准版,香槟金,6GB+64GB,耗电太快了 不打游戏不看视频听歌 用的时候才开网 只能半天 所有都开的省电模式都不敢怎么用 拿去检测说这是正常的 唉
2018-05-27 09:41:09,来自京东Android客户端,PLUS会员,标准版,宝石蓝,6GB+64GB,破手机 15天没到就卡  过了15天又卡又弹出程序  要求换货  没人搭理  破客服 垃圾手机
2018-05-16 16:02:22,来自京东Android客户端,金牌会员,标准版,亮黑色,6GB+64GB,钢化膜装上以后触摸相当不好用，不是膜的问题，就是屏幕的事，#了，滑动图片半天没有反应，跟老诺基亚那会的屏幕一样
2018-05-21 20:47:28,来自京东Android客户端,PLUS会员,标准版,宝石蓝,6GB+64GB,电池续航很失望，非常失望，不玩游戏不看电影，正常使用就半天，续航体验甚至不及三星note5。
2018-05-21 23:29:45,来自京东Android客户端,金牌会员,标准版,宝石蓝,6GB+128GB,一星都不想给，后悔了，各种各样的问题，都没有解决，要不是原厂膜坏了，我早退了，快递包装也好垃圾，都挤爆了。无语
2018-05-23 20:14:43,来自京东Android客户端,金牌会员,标准版,亮黑色,6GB+128GB,只能说越来越差劲?了，现在只注重相机和拍照了，关键是把跟相机相协调的相册功能也做好呀，其他功能越来差劲～
2018-05-28 13:52:28,来自京东Android客户端,银牌会员,标准版,亮黑色,6GB+64GB,手机用了不到一个月卡死了一次，打王者荣耀还不停的的闪屏，客服给了个检测的地址还不对，我想骂街，京东啊京东
2018-05-28 18:53:58,来自京东Android客户端,PLUS会员,标准版,樱粉金,6GB+64GB,"才用了20天屏幕 变成花屏 闪屏 一直闪
用不了
京东的答复是过了15天换不了"
2018-05-24 19:05:04,来自京东Android客户端,金牌会员,标准版,亮黑色,6GB+64GB,之前买的荣耀10一个多星期home键直接失灵不能使用了，又不能换货。现在再考虑要不要把p20退掉
2018-05-27 12:27:22,来自京东Android客户端,金牌会员,标准版,亮黑色,6GB+64GB,一直用三星noet，本着换换口味支持一下国货吧，不是一般的糟。根本不值这价，最多值2000元。
2018-05-27 22:00:56,来自京东Android客户端,银牌会员,标准版,宝石蓝,6GB+64GB,"手机后摄像头有划痕
跑步软件gps定位非常不准，我一公里跑一个小时？
就这样吧，不想说话。"
2018-05-23 22:16:04,来自京东Android客户端,金牌会员,标准版,亮黑色,6GB+64GB,不是我黑它 买了一个月玩吃鸡卡黑屏两次！！！从来没遇到过！我是真的服，决赛圈给我搞这个
2018-05-11 23:17:22,来自京东Android客户端,金牌会员,标准版,宝石蓝,6GB+64GB,除了拍照其他都是垃圾，玩游戏闪退，卡屏，充电屏幕失灵，大家千万别买，真的坑
2018-05-25 23:25:30,来自京东Android客户端,金牌会员,标准版,亮黑色,6GB+64GB,我不知道这评价是刷出来的还是怎么回事！亏我那么信任京东！第一天用就一卡一卡的！
2018-05-28 16:37:45,来自京东Android客户端,银牌会员,标准版,亮黑色,6GB+64GB,屏幕自带保护膜很脏、手机充电接口内插片有弯曲使用痕迹，要求退换客服不予处理
2018-05-26 00:26:06,来自京东Android客户端,银牌会员,标准版,亮黑色,6GB+64GB,"手机没怎么玩就发热，电池不行，第一次用华为就给个这，




一星都不想给"
2018-05-21 10:33:28,来自京东Android客户端,金牌会员,标准版,亮黑色,6GB+128GB,手机wifi连接不上，问客服也什么都不懂，手机本事还不错，就是客服沙币
2018-04-21 12:41:09,,钻石会员,标准版,亮黑色,6GB+64GB,整体就是感觉容易发烫
2018-05-25 07:01:21,来自京东Android客户端,PLUS会员,标准版,极光色,6GB+64GB,不是全屏，而且机身在使用和充电过程中容易发烫
2018-05-27 23:01:27,,金牌会员,标准版,亮黑色,6GB+64GB,这才用了一个半月，手机已经卡的不行了，华为啊华为，咋支持你
2018-05-20 15:16:57,来自京东Android客户端,银牌会员,标准版,亮黑色,6GB+64GB,稀烂，电池我就不说了，音量忽大忽小的，打字都会卡
2018-05-28 08:38:25,来自京东Android客户端,金牌会员,标准版,宝石蓝,6GB+64GB,微信卡到你没脾气。不知道是手机问题还是版本问题，
2018-05-23 17:08:56,来自京东Android客户端,PLUS会员,标准版,樱粉金,6GB+128GB,对自营这东西简直不想说话。
2018-05-24 00:19:34,来自京东Android客户端,金牌会员,标准版,宝石蓝,6GB+64GB,屏幕乱转，亮度自动乱调。关闭自动调节屁用没有
2018-05-21 10:28:00,来自京东Android客户端,银牌会员,标准版,极光色,6GB+64GB,什么东西都不带。除了耳机充电器 一个破塑料壳
2018-05-21 09:51:59,来自京东Android客户端,金牌会员,标准版,宝石蓝,6GB+64GB,卡死了，玩游戏基本玩不了，不知道能不能退了。
2018-05-27 21:33:35,来自微信购物,银牌会员,标准版,樱粉金,6GB+64GB,手机耗电量太大了，一天至少充两次电，
2018-05-26 12:12:29,来自京东Android客户端,金牌会员,标准版,亮黑色,6GB+128GB,垃圾！发烫严重，电池用不了多久
2018-05-22 11:58:05,来自京东Android客户端,金牌会员,标准版,极光色,6GB+64GB,用的百度输入法，看的都#
2018-05-26 21:55:52,来自微信购物,银牌会员,标准版,香槟金,6GB+128GB,质量有问题！也没发票！退货
2018-05-26 13:38:59,来自京东Android客户端,钻石会员,标准版,极光色,6GB+64GB,前置摄像头画质太假&hellip;&hellip;后置摄像都是斜在里面（说假话的死全家），外面看进去都还看得见零部件，我不知道是个体差异还是都是这种情况？作为华为旗舰产品，不应该出现这种情况，也不要被所谓的大师级摄像和徕卡镜头所迷惑！
2018-05-19 21:38:16,来自京东Android客户端,银牌会员,标准版,宝石蓝,6GB+128GB,电量消耗有点快?
2018-05-24 14:22:04,来自京东Android客户端,钻石会员,标准版,亮黑色,6GB+64GB,才买帮个月触屏就出问题
2018-05-23 19:03:40,来自京东Android客户端,金牌会员,标准版,宝石蓝,6GB+64GB,垃圾，手机发烫的厉害。
2018-05-22 11:38:06,来自京东Android客户端,钻石会员,标准版,宝石蓝,6GB+64GB,手机不行，发热太厉害了
2018-05-25 23:13:39,来自京东Android客户端,银牌会员,标准版,亮黑色,6GB+64GB,不好用，，，，，
2018-05-25 18:30:17,来自京东Android客户端,银牌会员,标准版,宝石蓝,6GB+128GB,不好用，有点卡
2018-05-20 10:00:04,来自京东iPhone客户端,金牌会员,标准版,亮黑色,6GB+64GB,电池耗电太快了&hellip;&hellip;心情不好
2018-05-26 19:20:21,来自京东Android客户端,银牌会员,标准版,樱粉金,6GB+128GB,耳机太次了
2018-05-20 18:50:13,来自京东Android客户端,银牌会员,标准版,亮黑色,6GB+64GB,没有发票，
2018-05-28 11:48:41,来自京东Android客户端,钻石会员,标准版,宝石蓝,6GB+64GB,差点感觉
2018-05-27 20:29:27,来自京东iPhone客户端,银牌会员,标准版,亮黑色,6GB+64GB,非常垃圾
2018-05-09 14:31:03,来自京东Android客户端,银牌会员,标准版,宝石蓝,6GB+64GB,"用了半个月 数据线鼓了
然后京东客服跟我绕圈说话
气死我了
差评给京东
p20手机做工不错
但是性价比来说还是建议pro
纯是为了p20小一圈才没买pro很后悔
再说一遍
京东客服真的蠢"
2018-05-26 19:29:30,来自京东Android客户端,金牌会员,标准版,亮黑色,6GB+64GB,什么手机，用了不到一个月就出现问题，就要拆机维修，谁家手机用了不到一个月愿意拆机维修，要是半年一年出现问题那也就认了，真的不想多说啥，差评差评差评
2018-05-28 14:01:00,来自京东Android客户端,金牌会员,标准版,亮黑色,6GB+64GB,自带的手机壳，刚用了几天就发现把手机边框刮花了，一开始还以为是进灰了。材质对不起它的价格。第一次给差评。懒得拍照了。
2018-05-21 11:55:52,来自京东Android客户端,钻石会员,标准版,亮黑色,6GB+64GB,手机是二手的   边框有划痕  客服不承认  差评  我一年在你们京东消费十几万  就这样对待客户?
2018-05-20 12:02:30,来自京东Android客户端,金牌会员,标准版,宝石蓝,6GB+64GB,差评，手机会卡，应用来回切换也会卡，才用了不到一个月。
2018-05-27 17:52:42,来自京东Android客户端,银牌会员,标准版,宝石蓝,6GB+64GB,服务太差   找他们都不会  差评
2018-05-09 21:37:28,来自京东Android客户端,金牌会员,标准版,樱粉金,6GB+64GB,我想问我手机发这样格式的图片出去别人看不怎么清楚，怎么会是这样的，叫别人怎么工作，怎么解决这个问题
2018-05-09 17:03:22,,PLUS会员,标准版,亮黑色,6GB+128GB,比较重，不如P10好用，发烫的厉害，这么烫估计寿命半年左右。
2018-05-09 14:31:03,来自京东Android客户端,银牌会员,标准版,宝石蓝,6GB+64GB,"用了半个月 数据线鼓了
然后京东客服跟我绕圈说话
气死我了
差评给京东
p20手机做工不错
但是性价比来说还是建议pro
纯是为了p20小一圈才没买pro很后悔
再说一遍
京东客服真的蠢"
2018-05-09 09:53:03,,金牌会员,标准版,亮黑色,6GB+128GB,体验感特别差，手机掉电能力特别强，不用 待机的情况下一上午50%的电没了，如果看看新闻一上午在12点之前就要插上充电线充电了 ，几乎跟用报废了的手机续航能力一样，找到客服除了说抱歉没别的，现在正想着得到一个完美的解决方案，不然这种窝火，我会投诉到各大头条，投诉到国家有关部门，主要是太坑了
2018-05-08 18:19:32,来自京东Android客户端,银牌会员,标准版,亮黑色,6GB+64GB,前天买的刚刚1点充电的时候放歌放个一首不放了 放的时候还卡了两下 太困也没看 刚刚起床还是那么多电还死机了屏幕一直亮着手机非常烫 怪好没有炸 是不是该给客户交代呢？？？？
2018-05-08 17:13:18,来自京东iPhone客户端,银牌会员,标准版,宝石蓝,6GB+128GB,没有说的那么好 像素不高 反应有点慢
2018-05-08 16:22:38,来自京东Android客户端,金牌会员,标准版,宝石蓝,6GB+64GB,#，玩个游戏，无线老断，流量也老断线，#，前一个p8也没这种现象
2018-05-08 12:04:07,来自京东iPhone客户端,银牌会员,标准版,亮黑色,6GB+64GB,不是说送移动电源吗！看别人晒图外壳，钢化膜什么都有！我怎么什么都没？解释一下呢！
2018-05-07 19:57:35,来自京东Android客户端,银牌会员,标准版,宝石蓝,6GB+64GB,此用户未填写评价内容
2018-05-07 18:13:25,来自京东Android客户端,金牌会员,标准版,亮黑色,6GB+64GB,我本来就想试一下这款手机跟小米mix2s，看到是无理由退货才下单买的。才到一天放在口袋都不敢跟金属类物品接触，第二天去退货就发现通话口有这样的划痕就无法退了，我真是醉了，我是真没咋用，唉，劝各位还是把钱花在小米mix2s上吧。
2018-05-07 16:35:26,来自京东Android客户端,金牌会员,标准版,亮黑色,6GB+64GB,发货是快，要不是买不到小米真不会买华为，其他方面真是一般般，满世界的吹嘘，其实用户心里才是最真实的，没有对比就没有伤害，但是不能欺骗消费者，就算关了可以省电的也是不耐电，客服不用忽悠我，我特地专门上网查了，贴吧也看了，能省点的都关了，但是心里还是不爽，花了钱感觉不值得，要不是确认收获了，我真退货，请问还可以退货吗？
2018-05-07 13:39:19,来自京东Android客户端,金牌会员,标准版,亮黑色,6GB+64GB,掉漆，呵呵了，华为，啧啧啧
2018-05-07 13:16:31,来自京东Android客户端,银牌会员,标准版,樱粉金,6GB+128GB,"手机收到了，然后发现开启应用的时候，打电话进来手机铃声不会响，也不会有震动。好几个电话没接到。
想要换货，结果说要审核之后才会发新手机。我旧手机已经扔了，3-7天，呵呵
想要退货然后买个新的，说什么审核不过的话手机会退回。
行行行，我TAMA自己去修，不退了，行了吧:)"
2018-05-07 12:27:30,来自京东Android客户端,PLUS会员,标准版,亮黑色,6GB+64GB,手机的电量消耗太快了
2018-05-07 11:12:36,来自微信购物,银牌会员,标准版,樱粉金,6GB+64GB,货到付款，一定要付款了才可以检查手机，没什么保障，然后就是好多最基本的软件显示不兼容，反正就是觉得这手机不好
2018-05-06 23:48:40,来自京东Android客户端,PLUS会员,标准版,亮黑色,6GB+64GB,各种卡！玩游戏卡！打开app也卡顿！三千多的手机还这么卡！坑呀！手机不行。物流还可以
2018-05-06 23:25:54,来自京东Android客户端,钻石会员,标准版,宝石蓝,6GB+64GB,我要的纸质版的发票没有，差评，和手机无关
2018-05-06 21:59:28,来自京东iPhone客户端,钻石会员,标准版,宝石蓝,6GB+64GB,使用苹果7p手机之后买了华为手机，使用之后，很多功能都不习惯，买之前看了一下店铺的差评，说的还是真的有那么回事，闪屏加摄像头也不是很清晰，还不如我之前用的苹果6s，手机拆包了，也退不了了，刚买的如果去修就成了旧手机了，很揪心。
2018-05-06 20:55:07,来自手机QQ购物,PLUS会员,标准版,宝石蓝,6GB+64GB,手机不错，物流不送到位，还说是京东自营？
