creationTime,userClientShow,userLevelName,productSize,productColor,saleValue,content
2018-05-06 19:41:30,来自京东Android客户端,银牌会员,标准版,亮黑色,6GB+64GB,手机声音太杂。，。。  货到付款  还刷了两次卡   扣了两份钱。  什么时候可以退回。  要怎么退
2018-05-06 19:30:23,来自京东Android客户端,金牌会员,标准版,宝石蓝,6GB+64GB,卡的要死，刺激战场太卡了
2018-05-06 18:22:04,来自京东Android客户端,钻石会员,标准版,亮黑色,6GB+128GB,"差评是针对这个套餐的，手机还是不错的。
当初图省事买了这个套装，到货发现这个翻盖的手机壳质量很差。
1.翻盖盖到屏幕上后发现上下两个角是翘着的，不平。
2.中间的软连接搞得很硬，造成合上盖子后又翘起来，得用手按一会才勉强合上。
3.还有就是尺寸也不合适，翻盖比手机屏幕大出一个边，攥着都咯手。"
2018-05-06 18:10:39,,银牌会员,标准版,亮黑色,6GB+64GB,拍照太差了，还不如之前的mate8，会议室拍照脸都是变形的，不是很明白为什么能把拍照吹上天！
2018-05-06 17:24:28,来自京东Android客户端,钻石会员,标准版,亮黑色,6GB+64GB,太不好用了屏幕触摸不好反应慢钱花的太坑了
2018-05-06 15:36:10,来自京东Android客户端,PLUS会员,标准版,宝石蓝,6GB+128GB,假货
2018-05-06 14:58:42,来自京东iPhone客户端,银牌会员,标准版,宝石蓝,6GB+64GB,没发票的吗？没手机发票。什么发票都没 什么意思？
2018-05-06 13:42:44,来自京东Android客户端,银牌会员,标准版,亮黑色,6GB+64GB,手机用的还可以，就是手机老是发烫，电池不怎么耐用
2018-05-06 13:35:21,来自京东iPhone客户端,钻石会员,标准版,樱粉金,6GB+128GB,网购第一个差评送给这次白条活动，太坑了，还要手动勾选，不然不免息，真是一个不注意就入坑了
2018-05-05 21:49:21,来自京东iPhone客户端,银牌会员,标准版,樱粉金,6GB+64GB,"手机还可以啦
但是好生气哦
头一天晚上特别晚了才买的
第二天就搞活动送半年碎屏险
气到想退货
差评"
2018-05-05 21:16:44,来自京东Android客户端,金牌会员,标准版,樱粉金,6GB+128GB,昨天晚上10多刚买的，第二天就有活动，还不给加上去。这么坑。。。
2018-05-05 15:56:36,来自京东Android客户端,银牌会员,标准版,亮黑色,6GB+64GB,这么说吧！不值  我说真的后台应用打开三个就杀死一个  玩吃鸡还闪退  要不是等不上抢不上某米谁买这玩意儿  真的是糟蹋钱
2018-05-05 10:48:42,来自京东Android客户端,PLUS会员,标准版,亮黑色,6GB+128GB,唯一的优点是宣传做的好！很不幸让我买了个阴阳屏，屏幕下面发黄，，给京东说让去找售后，去售后检测说这属于正常，不影响使用，真的一下子没有反驳理由了，只能自认倒霉了。本来冲着国产品牌买的，有点儿失望。谁都想买个没有半点儿毛病的手机，算我倒霉了。给了一星是给送货的快递小哥的。手机用着倒挺好，人脸识别个指纹解锁都挺快的。就屏幕这一点让我很不舒服，不知道发黄会不会越来越严重，真害怕国产玩意儿用不过半年就废了。
2018-05-05 09:56:19,来自京东Android客户端,银牌会员,标准版,亮黑色,6GB+64GB,买了一暖宝宝   联系客服还没有人   要退货了
2018-05-05 09:30:03,来自京东Android客户端,金牌会员,标准版,亮黑色,6GB+64GB,4号问客服5号华为p20有活动有优惠么？客服说没有，结果东西还没收到就说送半年的碎屏保险。我又不是不买你至于骗我么？
2018-05-04 21:44:57,来自京东Android客户端,金牌会员,标准版,亮黑色,6GB+64GB,运行速度没话说，就是电池不经用，作为一个轻度手机使用者电池管不到一天
2018-05-03 22:46:16,来自京东iPhone客户端,金牌会员,标准版,宝石蓝,6GB+64GB,很垃圾的手机，再中高档手机里面这手机真的很菜。客服也很不专业，什么都不懂就会官方那套敷衍话。再也不会理会华为手机了 真的飘了
2018-05-03 22:17:43,来自京东Android客户端,金牌会员,标准版,宝石蓝,6GB+64GB,左边@是坏的?
2018-05-03 22:11:58,来自京东Android客户端,银牌会员,标准版,樱粉金,6GB+64GB,好评？如果做不好售后服务就别拿出来买，问些会出现的问题一直叫找京东客服，第一次用京东麻烦得一批，差评接着好好改进吧
2018-05-03 21:35:37,来自京东Android客户端,银牌会员,标准版,樱粉金,6GB+64GB,手机有点厚，而且打电话总是听不到别人声音，时断时续，上个旧手机没有问题的，太让人失望了。早知道还不如换苹果的，最后一个华为手机！
2018-05-03 14:32:15,来自京东iPhone客户端,金牌会员,标准版,宝石蓝,6GB+64GB,非常差的体验，屏幕显示有很明显的横向条纹但是拍照看不出来，肉眼一对比就出来了，事不过三，连续两次给我发同样问题的的货，可见商家有意的把有问题的的批次在网上售卖，联系大家贵重的电子产品还是去实体店买吧，华为的品控如果按我拿到的概率来讲，是很糟糕的。
2018-05-03 13:14:38,来自京东Android客户端,银牌会员,标准版,宝石蓝,6GB+64GB,差评，手机买了不到一个月，卡的要死
2018-05-03 09:40:26,来自京东Android客户端,银牌会员,标准版,香槟金,6GB+64GB,华为p20我用了十几天过来评论，后摄像头有2个，原来一个那个是假的，华为国产也不可靠。
2018-05-03 03:09:23,来自京东Android客户端,银牌会员,标准版,樱粉金,6GB+64GB,还没打开看，买来给媳妇的惊喜，可包装磕坏了，不美观了，看包装应该是出库的时候就给磕到了，有点儿不舒服
2018-05-02 23:39:56,来自京东Android客户端,银牌会员,标准版,亮黑色,6GB+128GB,*的手机
2018-05-02 20:06:27,来自京东Android客户端,金牌会员,标准版,宝石蓝,6GB+64GB,这就是华为售后，气死我了，耽误事，充满电一会儿就没电了，退货不给退，换个别的型号，也不给换，#。
2018-05-02 19:03:25,来自京东Android客户端,银牌会员,标准版,香槟金,6GB+64GB,客服差评就知道自动回复！有问题根本没有正面回复！！！！还旗舰店！京东客服更是！真不知道这个破平台**怎么还会那么高！赠送的电信卡根本不能用！欺骗消费者！联系京东客服就知道tama自动回复！头一次给差评！大家千万不要买了！??
2018-05-02 17:48:55,来自京东Android客户端,银牌会员,标准版,宝石蓝,6GB+128GB,物流真**垃圾，如果不是急着用手机，直接就退货了，快递一点责任心都没有，差评5颗星！手机待用后再做评论
2018-05-02 13:49:36,来自京东Android客户端,金牌会员,标准版,亮黑色,6GB+128GB,非常不满意的购物，手机有问题不能及时解决
2018-05-02 13:47:54,来自京东Android客户端,金牌会员,标准版,亮黑色,6GB+64GB,一星都不想给，但只能给一个，前天买到，登录微信，玩个小程序游戏，微信自动重启一整天都这样，返回界面卡顿延迟？截图失效，买了好几部华为，从都没这样过，非常非常失望，
2018-05-02 11:38:15,来自京东Android客户端,银牌会员,标准版,亮黑色,6GB+64GB,买了有两天了，用起来是没问题。但是玩游戏真的不行。。也不知道是这～970的GPU问题，还是因为控温限制问题，掉帧严重反正只要玩游戏画面就不流畅。完全体验不到这款处理器的强大。现在有点后悔一时冲动买了这手机。玩游戏真不适合。三千多买台小米旗舰都可以秒杀华为全部手机了。
2018-05-02 10:36:08,来自京东Android客户端,银牌会员,标准版,亮黑色,6GB+128GB,"强烈建议大家不要在这里买p20，建议大家去官方实体店买。我将本人亲身体验告诉大家，原因有三:
一、价格都一样；二、实体店购买，现场可以验机；三、京东上买手机如有问题，会磨死人。
本人经历具体如下:
4月23日在此店（华为京东官方店）买的p20，5月1日我发现有个高光点。此店经销商买前很热情，到了发现手机质量有问题前去咨询，鸟都不鸟你（聊天记录、手机高光点见下图）。
一个高光点确实是个小问题，但对于消费者来说谁想花同样的价钱却买个问题机，主要还是担心日后还会不会爆出更多的高光点，更多问题。虽然京东服务无差，有退换货维修等服务，但寄来寄去至少一周（这对于先前手机已恢复出厂设置，准*的我非常不便）。其后我网上查询并致电江西地区实体官方门店电话，其反馈我说，（京东说是说换，其实也就是和你修一修，或者拿其他修好的手机里挑一个给你）虽然他这句话可信度存疑，但是他一句话却让我脑补了一堆画面，至少已经影响了我未来在京东的消费行为，养成买前要三思，而不再是以前冲京东的牌子直接购买。"
2018-05-02 09:44:33,来自京东iPhone客户端,金牌会员,标准版,宝石蓝,6GB+128GB,"阴阳屏，四千多买个膈应人的手机，难道华为觉得阴阳屏是正常的？？
另外包装内就是手机盒子，一点泡沫塑料缓冲啥的材料都没有"
2018-05-01 22:20:38,来自京东Android客户端,PLUS会员,标准版,樱粉金,6GB+64GB,"本来只想评价华而不实，为所欲为，想想还是说几句。
第一次买华为，真心是因为最近没啥好一点的新手机出来等不了所以尝试了。
优点是拍照确实好，续航与充电一般，不过远优于我以前的苹果6s。
缺点挺多的，首先是屏幕阴阳屏 下部和上部偏黄尤其下部，我去了体验店样机更严重所以申请退货想想还是取消了。
然后是流畅度，我说实话，和一千多的手机在大部分操作界面流畅度差不多的，我吃鸡还行，玩个消消乐都有点点掉帧我也是醉了。
京东包装上有个撕开就必须开箱验货的封条已经是撕过的，我觉得是不是别人退货的很烦。
做工只能说一般，后盖靠着typec接口出处有缝隙。
摄像头偏心有点，不过没其他人那么夸张，使用好像也没影响。"
2018-05-01 17:07:43,来自手机QQ购物,金牌会员,标准版,亮黑色,6GB+64GB,手机耳机2对，一对带转换接口能用，一对不带不能用，华为客服告知官方只有一对耳机，很是纠结呀。
2018-05-01 13:52:33,来自京东Android客户端,金牌会员,标准版,樱粉金,6GB+64GB,莫名其妙，怎么会多了陌生的联系人信息，怀疑是返修机！
2018-04-30 23:11:55,来自京东Android客户端,钻石会员,标准版,亮黑色,6GB+64GB,我想问一下我18年4月27日晚上下单买的手机里面怎么有18年4月27日上午的视频文件
2018-04-30 21:35:04,来自京东Android客户端,PLUS会员,标准版,亮黑色,6GB+64GB,刚收到，手机不错，但京东工作人员的工作态度有问题，我的手机膜居然刮花了，还有压痕，只好自己去重贴一张膜，这是在京东购物最不爽的一次。我可以怀疑手机是别人退货的问题机吗？
2018-04-30 21:07:13,来自京东Android客户端,金牌会员,标准版,香槟金,6GB+128GB,用了几天了，电池超不耐用。像素还算可以，店家服务态度极不满意，用个词形容&ldquo;傲慢&rdquo;冷漠，联系商家总是不回复，我都不知道还要那客服有什么用。除了系统自动发信息外，很少回复的。
2018-04-30 20:17:01,来自京东Android客户端,钻石会员,标准版,亮黑色,6GB+64GB,摄像头里不知道是进灰，还是出厂带有灰，阳光下验收一下便知，灯光下看不到有灰，电池免强用一天，系统操作不够方便
2018-04-29 21:35:51,来自京东Android客户端,银牌会员,标准版,樱粉金,6GB+64GB,京东服务很好的啦，物流超快的啦，手机这个锅京东是背定的啦，充电一分钟，暖手半小时的啦，冬天出门取暖神器的啦，地图软件开启两秒钟，GPS定位&hellip;&hellip;等一下？定位？不存在的，地图说它无法定位，再开也说无法定位，最后再开一次说定位？这辈子都不可能定位的啦。最后一百度就全明白了啦
2018-04-29 13:03:54,来自京东Android客户端,银牌会员,标准版,宝石蓝,6GB+64GB,电板不经用软件安装了用不了差评
2018-04-29 11:34:23,,银牌会员,标准版,宝石蓝,6GB+64GB,物流速度快，手机运行速度更快，外型感觉不错，非常完美物有所值，客服态度也好。还会追评的。
2018-04-29 10:29:20,来自京东Android客户端,金牌会员,标准版,樱粉金,6GB+64GB,身为搞工艺的我 ，对这屏幕上的小点无法容忍，可以想想华为手机出厂审核的标准哪去了？下次在京东买东西得三思
2018-04-28 22:07:48,来自京东Android客户端,金牌会员,标准版,亮黑色,6GB+64GB,，垃圾双@只有一个@有声音，妈的，京东一点都不靠谱，卖的烂货
2018-04-28 13:21:11,来自京东Android客户端,银牌会员,标准版,樱粉金,6GB+128GB,说好的赠品一个都没有，什么商家啊
2018-04-28 10:09:32,来自京东Android客户端,金牌会员,标准版,亮黑色,6GB+64GB,太抠了，什么也没有送，
2018-04-28 07:53:59,来自京东Android客户端,金牌会员,标准版,宝石蓝,6GB+64GB,差评，卡槽都取不出来，卡针都差不进，神烦，下次再也不在京东上买了
2018-04-27 22:56:16,来自京东Android客户端,银牌会员,标准版,亮黑色,6GB+64GB,玩游戏太卡了
2018-04-27 16:21:46,来自微信购物,银牌会员,标准版,宝石蓝,6GB+64GB,快递京准达骗人的  根本达不了，我要投诉
2018-04-27 14:31:27,来自京东Android客户端,金牌会员,标准版,亮黑色,6GB+64GB,京东太垃圾了，明明没开发票，退货时给我要发票，我压根就没收到发票，从哪给你们。手机电池耗电太快，如不提供发票要扣17%税钱646元，去***的，就没收到发票老子从哪给你，无奈只能不退货了，老子一年在京东买十几万的东西，只要不打电话要发票从来不主动开发票的，这次也一样没开，要退货了给要税票，垃圾
2018-04-27 13:32:43,来自京东iPhone客户端,钻石会员,标准版,亮黑色,6GB+64GB,我不知道是不是其他人也一样，手机音量键和开关键非常松动，摇手机的时候还能听到按键晃动的声音，提出售后要求换机，京东来电话说手机没问题，但会给我换机。今天收到货，明显还是我退回的那台，按键还是松动的，手机背面膜还是脏的，屏幕上的膜还是黏的，你京东如果说华为新机就是这样的，那我无话可说。
2018-04-27 11:45:06,来自京东Android客户端,钻石会员,标准版,宝石蓝,6GB+128GB,耗电太快，玩刺激战场不流畅，卡的无语，跟不上节奏，还不如旧的OPPO11s。考虑退了
2018-04-27 05:45:46,来自京东Android客户端,金牌会员,标准版,宝石蓝,6GB+128GB,打电话声音超级大，旁边人听说的一清二楚，屏幕下部偏黄
2018-04-27 00:09:57,来自微信购物,金牌会员,标准版,宝石蓝,6GB+64GB,垃圾。手机老是卡，反应不快。还老是黑屏
2018-04-26 21:46:59,来自京东Android客户端,金牌会员,标准版,樱粉金,6GB+64GB,我不想说了，真的不是很好用一分我都嫌多，居然卡居然卡是我有毒还是你有毒
2018-04-26 17:14:00,来自京东iPhone客户端,PLUS会员,标准版,宝石蓝,6GB+64GB,"说实话，本来对华为有很大的期待，但是拿到手机之后呢，觉得有点失望:
1.反应速度，我和我老婆的vivo x9做了一下对比，着实让我失望，无论是打开网页，还是软件，又或者是游戏，华为p20都不如x9.
无线网连接速度，连接同一个无线网，我的苹果8的网络速度完胜华为p20，p20打开软件，经常是一直在那里缓冲。经常出现没有网络的情况，提示重试！
3.这个电池的电，和苹果8简直不在一个档次，耗电太快！
      和三星，苹果这样的公司比，华为手机真是让我挺失望的，买过就后悔了！
4.价格偏贵，华为这个手机手机系列，整体手机偏贵，这个手机的性能不值这个价！"
2018-04-26 15:15:32,,金牌会员,标准版,樱粉金,6GB+64GB,差评，首先指纹开锁等于没用，机身无敌粘指纹，上手就留下指纹一堆，无论是前还是后；第二，发票没一起开过来，也没消息说什么时候有，问了还说发票属于京东负责，让自行咨询解决&hellip;&hellip;拜托，我是在你店里买的，为个发票我还到处找人&hellip;&hellip;心情不好
2018-04-26 14:03:59,,钻石会员,标准版,宝石蓝,6GB+128GB,出现死屏！
2018-04-26 13:22:10,来自京东Android客户端,银牌会员,标准版,樱粉金,6GB+64GB,就想说一句，屏幕太花了，尤其是看抖音，快手，腾讯，等等换了两次，都有问题，我也是服了，一个旗舰机居然出这样的问题，太失望了！
2018-04-26 11:15:53,,金牌会员,标准版,香槟金,6GB+128GB,京东服务让人无语，因为颜色取消了订单，然后要求配送，客服反复内部确认告诉我无法送货，让我重新下单，然后又送货了，折腾了十多个电话，拜托能不能专业一点。
2018-04-26 11:04:03,来自京东Android客户端,银牌会员,标准版,亮黑色,6GB+128GB,"用了12 天，体验真心差。
第一，后台运行的永远关不掉（除非重启），虽然你手动结束了后台运行，但是实际上，它还是在那里耗电占内存，一般用一天运存就达到了80%的程度，怎么降都降不下来，除非重启。
第二，这几天给同学拍毕业照，卡住了，居然卡住了（真心没开其他软件），而且有莫名的歌声从手机里传出来，看了一下，并没有开音乐软件，后来重启才能动，才没声音的，用户体验真心差
第三，现在想退货但是售后并不允许了，因为只有7天无理由退货，14天之内只能换货，但是这款手机给我的体验太差，想退居然退不了！
第四，我开微信聊天居然都还会卡住，显示不了那些微信消息，不是网络原因，只是这台手机真心差，以后不敢信华为了。。。
真心一颗星都不想给"
2018-04-26 10:49:21,来自京东Android客户端,金牌会员,标准版,宝石蓝,6GB+128GB,耗电很快，真心还没我p9待机长
2018-04-25 22:02:33,来自京东Android客户端,金牌会员,标准版,宝石蓝,6GB+64GB,对于当下很便捷的支付，华为的手机居然不支持微信指纹支付。真的很难理解，国产机器居然这么狗，外来机居然都可以了。垃。。圾然不让打，京东也是#。
2018-04-25 19:06:49,来自京东Android客户端,PLUS会员,标准版,宝石蓝,6GB+64GB,说实话没有宣传的那么好，新手机偶尔点返回没有反应，电池也不想3400，京东买东西从来没有给过差评，第一次买华为也是第一次给京东差评。我是多年的魅粉。很失望，很失望&hellip;&hellip;
2018-04-25 17:06:07,来自京东Android客户端,金牌会员,标准版,宝石蓝,6GB+64GB,看抖音模糊看朋友圈视频模糊 感觉有时候看图片也模糊，在网上查了一下应该不是个例。别人回复都是片源不清晰，但是看同样的视频为啥我的老果6就没问题，同事的红米也没问题。求解！
2018-04-25 13:54:30,来自微信购物,银牌会员,标准版,宝石蓝,6GB+64GB,看到这张照片估计很多人都知道我的职业了吧，本来想买个信号好的手机用来接单，可是信号好有什么用呢？打开这个软件，接到单了，没两分钟就退出了，到了乘客地方又得打开，接到乘客没两分钟又退了，每次都这样，国产手机还这么贵？好吧，你贵可以，但是你这垃圾系统为什么这么不稳定？为什么要退？联系客服也没用！
2018-04-25 13:38:38,来自京东Android客户端,金牌会员,标准版,宝石蓝,6GB+64GB,有花纹，请问华为能够用心一点么？第一次买就觉得，包装什么的都没有其他手机那样给人舒心的感觉。
2018-04-25 09:23:33,来自京东Android客户端,金牌会员,标准版,亮黑色,6GB+64GB,16号买的，17号到的货，用到今天是第九天，刚开始用的还不错，现在看两个半小时电影手机就没电了，而且在昨天还出现在手机卡读不出来的情况，我是两个手机号，联通的卡读得出来，移动卡读不出来，后来重启好了，今天早上起来又出现了移动卡读不出来的情况，然后重启也没用，我就拿我朋友的移动卡试了一下，也读不出来，但是单卡就读得出来，双卡直读的出来联通卡，我把两张移动卡都上去试了一下，都读不出来，然后没办法，重启了五六次，移动卡才读出来，找客服，半天不理人，都说要支持国产，就这个质量，唉不想说了！
2018-04-24 19:16:07,来自京东Android客户端,银牌会员,标准版,香槟金,6GB+64GB,屏幕分辨率太低，和其它华为手机一次比简直太差
2018-04-24 18:16:42,来自京东Android客户端,金牌会员,标准版,宝石蓝,6GB+128GB,除非你随时携带移动电源，否则，满电状态，正常使用，不玩游戏，聊聊微信，上上网，能熬过一天，算我输！！！
2018-04-24 17:56:27,来自京东Android客户端,银牌会员,标准版,宝石蓝,6GB+64GB,这个差评我是一定要给的，手机买回来才两天，背壳就刮花了，期间就正常的拿放手机，不知怎么的就花了，背壳下半部分感觉像是被放在地上使劲摩擦过一般，磨痕明显。整体看上去背部给人的感觉更像是塑料。
2018-04-24 14:42:20,来自京东Android客户端,金牌会员,标准版,亮黑色,6GB+64GB,本人在京东商城看好了nt10，跟客服人员谈好了配置及清单后我直接就买了因为我一直支持华为，相信华为。但是我点了连接下单今天收到货居然是20，于是我跟客服人员联系他说他没错按订单发的货，我说我们聊天记录是10，我是点的连接没看型号。客服直接说是我的问题，我就问了他难道我们聊的是10你给我发个p20你就没审查单子？就不理我了，我今天收到了p20直接了丢了，又买个10但是不在你这里买，就你这样的态度我不想评价。自己去想。
2018-04-24 11:37:10,,企业会员,标准版,香槟金,6GB+64GB,*
2018-04-24 10:03:53,,银牌会员,标准版,亮黑色,6GB+64GB,手机没的说用了3天感觉比较好！但是对京东某些比较失望，我解释一下下图。第一张图是买手机附送的电信卡里面的活动内容，最后两个步骤说直白点就是，首次充钱后领取礼包然后送一个一年的屏保碎险。注意领取礼包后7天之内需要交资料不然作废！但是小弟按步骤充值了领取礼包了，到了第4部该交屏保资料了，可恶的京东宝宝又让我回到第三部让我先领礼包，大家可以看时间，第二张图时间是9.31分短信提示我在12分钟前已经领取了礼包， 第三张图时间9.32分我在操作这个步骤时，说我先领礼包，有图有真相我明明已经领取了！现在我想问京东到底能不能承担起那份碎屏险！！不能这样骗炮吧！
2018-04-24 00:37:05,来自京东Android客户端,PLUS会员,标准版,亮黑色,6GB+64GB,打电话对面的听不到我说话，申请换货了，希望换了之后不会让我失望吧。
2018-04-23 23:28:40,来自微信购物,金牌会员,标准版,宝石蓝,6GB+64GB,比同配荣耀10贵*大洋，这么贵的手机没红外，还存在阴阳屏现象，只能说买的有点着急了。
2018-04-23 22:07:25,来自京东Android客户端,金牌会员,标准版,宝石蓝,6GB+64GB,发热严重，真的很垃圾，我去?
2018-04-23 20:50:49,来自京东Android客户端,银牌会员,标准版,宝石蓝,6GB+128GB,一颗星都不想给，我总觉得我的手机铃声低，要不是同事帮我测试我都发现不了左边的喇叭竟然没有声音，大家高兴之于还是检查一下自己的手机吧
2018-04-23 20:10:44,来自京东Android客户端,PLUS会员,标准版,宝石蓝,6GB+64GB,不好，手机反应什么的还可以，就是屏幕有一个划痕，差评
2018-04-23 18:34:14,来自京东Android客户端,银牌会员,标准版,宝石蓝,6GB+128GB,不好的购物体验，别的店都送好几件东西，这个店一样东西都没有送，
2018-04-23 13:19:30,,金牌会员,标准版,宝石蓝,6GB+128GB,头次用华为产品。第一次收到货，后置摄像头是歪的，没开机直接换货。第二次，1，阴阳屏太明显。 2，后置摄像头还是有一点歪。 懒得再换了，退货。4000多的手机啊，不是1，2千！ 对这个牌子失望。吹嘘对标苹果超越三星，苹果三星质量就这水平？这是你的旗舰机之一啊！拜托用心点好吗。几年之内不会再考虑这个牌子
2018-04-23 12:41:13,来自京东Android客户端,金牌会员,标准版,宝石蓝,6GB+64GB,联系不要买，什么都好就是货不好，扬声器声音有点闷，可能是我自己听惯，但打电话听筒经声音常性的变小，变远，客服万年没人在
2018-04-22 22:23:45,来自京东Android客户端,PLUS会员,标准版,亮黑色,6GB+128GB,刚到的手机没有信号，差评
2018-04-22 20:50:03,来自京东Android客户端,银牌会员,标准版,宝石蓝,6GB+64GB,京东但是挺快这 就是这耳机插头的地方有个缺口能告诉我咋回事吗？就这糊弄我们？？？
